{
  "save_schema_version": 1,
  "profile_revision": 3,
  "credits": 12500,
  "career": {
    "licenses": [
      "road-basic"
    ],
    "reputation": {
      "road": 120,
      "circuit": 25
    }
  },
  "vehicles": [
    {
      "instance_id": "vehicle-0001",
      "definition_id": "ta.base:vehicle-ta-p01",
      "definition_version": 1,
      "odometer_m": 18234.5,
      "engine_hours": 5.4,
      "installed_component_ids": [
        "ta.base:engine-i4t-20"
      ],
      "fuel_fraction01": 0.62,
      "battery_soc01": 0.91,
      "damage_model_version": 2,
      "physics_version": 2
    }
  ],
  "transactions": [
    {
      "id": "tx-0001",
      "type": "event_reward",
      "credit_delta": 2500
    }
  ]
}
